data_coleta;ticker;descricao;patrimonio;p_vp;dy;dy_5anos;liquidez;tipo;segmento
2026-05-26;KNCR11;Kinea Rendimentos Imobiliários Fundos;10,96 B;1,03;13,92;11,39;20,91 M;Fundo de Papel;Títulos e Valores Mobiliários
2026-05-26;ISNT11;Itaú Isento Março 28 Fic Fi-Infra;7,67 B;1,01;;;14,13 M;Outro;Fundo de Infraestrutura (FI-Infra)
2026-05-26;KNIP11;Kinea Índice De Preços Fundo;7,52 B;0,98;10,26;11,77;9,45 M;Fundo de Papel;Títulos e Valores Mobiliários
2026-05-26;HGLG11;Pátria Log;7,23 B;0,91;8,53;8,6;14,39 M;Fundo de Tijolo;Logístico / Indústria / Galpões
2026-05-26;ISEN11;Itaú Isento Março 29 Fic Fi De Infraestrutura;6,76 B;1,02;;;5,24 M;Outro;Fundo de Infraestrutura (FI-Infra)
2026-05-26;XPML11;Xp Malls Fundos;6,47 B;0,97;10,35;8,8;17,69 M;Fundo de Tijolo;Shoppings / Varejo
2026-05-26;TRXF11;Trx Real Estate;6,17 B;0,93;12,88;10,57;21,95 M;Fundo de Tijolo;Híbrido
2026-05-26;BTLG11;Btg Pactual Logística;5,46 B;1,0;9,24;8,77;12,50 M;Fundo de Tijolo;Logístico / Indústria / Galpões
2026-05-26;XPLG11;Xp Log;5,42 B;0,92;10,09;8,63;7,97 M;Fundo de Tijolo;Logístico / Indústria / Galpões
2026-05-26;BISE11;Infra Bise;4,89 B;1,01;;;4,26 M;Fundo de Papel;Fundo de Infraestrutura (FI-Infra)
2026-05-26;KNRI11;Kinea Renda Imobiliária;4,61 B;1,0;7,6;7,59;10,14 M;Fundo de Tijolo;Híbrido
2026-05-26;MXRF11;Maxi Renda;4,32 B;1,06;11,97;11,69;13,91 M;Fundo de Papel;Híbrido
2026-05-26;FTCE11B;Opportunity;3,93 B;0,95;;4,78;2,92 M;Outro;Híbrido
2026-05-26;ISTT11;Itaú Isento Setembro 29 Fic Fi De Infra Rf;3,73 B;1,01;;;4,57 M;Outro;Fundo de Infraestrutura (FI-Infra)
2026-05-26;VISC11;Vinci Shopping Centers;3,35 B;0,92;9,18;8,41;11,11 M;Fundo de Tijolo;Shoppings / Varejo
2026-05-26;CPTS11;Capitania Securities Ii;3,22 B;0,86;14,01;12,21;13,22 M;Fundo de Papel;Títulos e Valores Mobiliários
2026-05-26;KNHY11;Kinea High Yield Cri;3,09 B;1,01;13,31;13,18;3,32 M;Fundo de Papel;Títulos e Valores Mobiliários
2026-05-26;HGRU11;Pátria Renda Urbana;2,99 B;1,0;9,62;9,1;4,34 M;Fundo Misto;Híbrido
2026-05-26;IRIM11;Iridium;2,97 B;0,81;14,15;11,76;4,38 M;Fundo de Papel;Híbrido
2026-05-26;PVBI11;Vbi Prime Properties;2,92 B;0,68;7,39;7,61;4,02 M;Fundo de Tijolo;Lajes Corporativas
2026-05-26;KDIF11;Kinea Fi - Infra;2,89 B;1,0;12,62;9,94;3,83 M;Outro;Fundo de Infraestrutura (FI-Infra)
2026-05-26;CDII11;Sparta Infra Cdi Fic Fi-Infra;2,81 B;0,98;17,53;14,03;7,84 M;Outro;Fundo de Infraestrutura (FI-Infra)
2026-05-26;GARE11;Guardian Real Estate;2,72 B;0,89;11,94;10,77;12,23 M;Fundo de Tijolo;Híbrido
2026-05-26;HGBS11;Hedge Brasil Shopping;2,67 B;0,97;9,46;8,29;5,52 M;Fundo de Tijolo;Shoppings / Varejo
2026-05-26;TGAR11;Tg Ativo Real;2,59 B;0,53;18,57;13,14;7,90 M;Fundo de Desenvolvimento;Híbrido
2026-05-26;GGRC11;Zagros Renda Imobiliária;2,37 B;0,91;11,95;10,01;9,98 M;Fundo de Tijolo;Logístico / Indústria / Galpões
2026-05-26;RECR11;Fii Rec Recebíveis Imobiliários;2,35 B;0,91;13,14;13,31;3,27 M;Fundo de Papel;Títulos e Valores Mobiliários
2026-05-26;HCTR11;Hectare Ce;2,34 B;0,16;21,43;14,73;1,03 M;Fundo de Papel;Títulos e Valores Mobiliários
2026-05-26;BRCR11;Btg Pactual Corporate Office;2,28 B;0,52;11,07;9,7;2,60 M;Fundo de Tijolo;Híbrido
2026-05-26;HSML11;Hsi Malls;2,21 B;0,85;9,3;9,09;8,34 M;Fundo de Tijolo;Shoppings / Varejo
2026-05-26;KNUQ11;Kinea Unique Hy Cdi Fundo De Investimento Imob;2,18 B;1,03;14,8;11,17;4,54 M;Fundo de Papel;Títulos e Valores Mobiliários
2026-05-26;KNCA11;Kinea Crédito Agro Fiagro;2,18 B;0,93;14,15;13,66;4,33 M;Outro;Fiagros
2026-05-26;JSRE11;Js Real Estate Multigestão - Fii;2,14 B;0,59;9,44;8,16;3,78 M;Outro;Híbrido
2026-05-26;BRCO11;Bresco Logística;2,09 B;1,04;8,99;8,49;6,56 M;Fundo de Tijolo;Logístico / Indústria / Galpões
2026-05-26;JURO11;Sparta Infra Fic Fi-Infra;2,08 B;0,96;12,07;13,25;5,58 M;Outro;Fundo de Infraestrutura (FI-Infra)
2026-05-26;BTHF11;Btg Pactual Real Estate Hedge Fund;2,07 B;0,91;12,54;7,42;2,93 M;Fundo de Papel;Híbrido
2026-05-26;GZIT11;Gazit Malls;2,03 B;0,47;19,27;12,38;598,60 K;Fundo Misto;Híbrido
2026-05-26;KNHF11;Kinea Hedge Fund Fdo De Inv Imob;1,99 B;0,97;12,26;9,59;3,96 M;Fundo Misto;Híbrido
2026-05-26;LVBI11;Vbi Logístico;1,94 B;0,89;8,36;8,58;3,68 M;Fundo de Tijolo;Logístico / Indústria / Galpões
2026-05-26;KNSC11;Kinea Securities;1,78 B;1,04;12,36;12,35;6,08 M;Fundo de Papel;Títulos e Valores Mobiliários
2026-05-26;HFOF11;Hedge Top;1,77 B;0,83;10,38;9,95;3,27 M;Fundo de Fundos;Títulos e Valores Mobiliários
2026-05-26;PFIN11;Perfin Apollo Energia Fip Em Infraestrutura;1,76 B;0,62;48,7;6,44;2,48 M;Outro;Fundo de Investimentos em Participações (FIP)
2026-05-26;HGRE11;Patria Escritórios;1,74 B;0,89;9,52;8,68;2,61 M;Fundo de Tijolo;Lajes Corporativas
2026-05-26;ALZR11;Alianza Trust Renda Imobiliária;1,74 B;0,99;9,69;8,98;2,22 M;Fundo de Tijolo;Híbrido
2026-05-26;RZTR11;Riza Terrax;1,73 B;0,98;13,51;12,54;5,25 M;Outro;Híbrido
2026-05-26;MCLO11;Mauá Capital Logística;1,72 B;0,75;10,93;7,96;265,52 K;Outro;Logístico / Indústria / Galpões
2026-05-26;VILG11;Vinci Logística;1,68 B;0,86;9,32;8,29;3,65 M;Fundo de Tijolo;Logístico / Indústria / Galpões
2026-05-26;RBVA11;Rio Bravo Renda Varejo;1,66 B;0,9;11,31;11,54;1,86 M;Fundo de Tijolo;Híbrido
2026-05-26;TVRI11;Tivio Renda Imobiliária Fundo De Investimento Imob;1,66 B;0,88;13,77;12,12;1,54 M;Fundo de Tijolo;Agências Bancárias
2026-05-26;RURA11;Itaú Asset Rural Fiagro;1,64 B;0,86;15,09;12,43;3,21 M;Outro;Fiagros
2026-05-26;PMLL11;Genial Malls;1,64 B;0,91;10,18;8,74;5,76 M;Fundo de Tijolo;Shoppings / Varejo
2026-05-26;MCCI11;Mauá Capital Recebíveis Imobiliários;1,62 B;0,99;12,49;11,88;5,99 M;Fundo de Papel;Títulos e Valores Mobiliários
2026-05-26;PCIP11;Patria Crédito Imobiliário Índice De Preços Fii;1,59 B;0,89;8,19;3,13;2,89 M;Fundo de Papel;Híbrido
2026-05-26;RBRR11;Rbr Rendimento High Grade;1,53 B;0,89;11,87;11,36;4,82 M;Fundo de Papel;Títulos e Valores Mobiliários
2026-05-26;IFRA11;Itau Fdo Inv Cotas Fdo Incent De Inv Infr. Rf Cp;1,52 B;1,02;11,78;11,0;1,87 M;Outro;Fundo de Infraestrutura (FI-Infra)
2026-05-26;HGCR11;Cghg Recebíveis Imobiliários;1,52 B;0,97;12,55;12,05;3,20 M;Fundo de Papel;Títulos e Valores Mobiliários
2026-05-26;BDIF11;Fundo Em Infraestrutura Btg Pactual Dívida Infra;1,49 B;0,9;12,97;12,39;2,70 M;Outro;Fundo de Infraestrutura (FI-Infra)
2026-05-26;RBRX11;Rbr Plus Multiestratégia Real Estate;1,44 B;0,85;13,04;12,68;3,38 M;Fundo de Fundos;Títulos e Valores Mobiliários
2026-05-26;VGIR11;Valora Re Iii;1,43 B;0,97;16,05;13,11;5,09 M;Fundo de Papel;Títulos e Valores Mobiliários
2026-05-26;VGHF11;Valora Hedge;1,40 B;0,72;15,36;13,4;5,91 M;Fundo de Papel;Híbrido
2026-05-26;VCJR11;Vectis Juros Real;1,39 B;0,83;13,56;12,58;3,00 M;Fundo de Papel;Títulos e Valores Mobiliários
2026-05-26;HSLG11;Hsi Logística;1,39 B;0,82;9,33;9,15;1,15 M;Fundo de Tijolo;Logístico / Indústria / Galpões
2026-05-26;DEVA11;Devant Recebíveis Imobiliários;1,38 B;0,2;22,23;15,01;673,36 K;Fundo de Papel;Títulos e Valores Mobiliários
2026-05-26;PSEC11;Vbi Reits Fof;1,38 B;0,78;13,63;11,58;3,84 M;Fundo de Fundos;Títulos e Valores Mobiliários
2026-05-26;VRTA11;Fator Verita;1,31 B;0,91;13,27;12,15;1,91 M;Fundo de Papel;Títulos e Valores Mobiliários
2026-05-26;RBRY11;Rbr Private Crédito Imobiliário;1,29 B;0,93;14,92;12,99;7,16 M;Fundo de Papel;Títulos e Valores Mobiliários
2026-05-26;BROF11;Brpr Corporate Offices;1,28 B;0,49;11,88;10,43;1,76 M;Fundo de Tijolo;Híbrido
2026-05-26;CPTI11;Capitânia Infra Fic Fi-Infra Rf Cp;1,27 B;0,94;14,3;12,28;2,57 M;Outro;Fundo de Infraestrutura (FI-Infra)
2026-05-26;GTWR11;Green Towers;1,22 B;0,8;13,26;11,52;1,25 M;Fundo de Tijolo;Lajes Corporativas
2026-05-26;GSFI11;General Shop E Outlets Do Brasil;1,21 B;0,89;;;1,56 M;Fundo de Tijolo;Shoppings / Varejo
2026-05-26;MCRE11;Mauá Capital Real Estate;1,14 B;0,91;14,22;12,94;2,59 M;Fundo de Papel;Títulos e Valores Mobiliários
2026-05-26;BRZP11;Brz Infra Portos Fdo, Inv. Em Part. Infraestrutura;1,10 B;0,9;;;1,50 M;Outro;Fundo de Investimentos em Participações (FIP)
2026-05-26;CPSH11;Shoppings Aaa Fdo De Inv Imob;1,10 B;0,87;13,04;10,07;3,33 M;Fundo de Tijolo;Shoppings / Varejo
2026-05-26;XPIE11;Xp Infra Ii Fdo De Inv Part Ie;1,09 B;0,67;13,41;8,26;922,96 K;Outro;Fundo de Investimentos em Participações (FIP)
2026-05-26;VGIP11;Valora Cri Índice De Preço;1,08 B;0,88;13,6;13,07;2,58 M;Fundo de Papel;Títulos e Valores Mobiliários
2026-05-26;PICE11;Pátria Infraestrutura Energia;1,05 B;0,24;1,5;2,52;109,06 K;Outro;Fundo de Investimentos em Participações (FIP)
2026-05-26;JCCJ11;Jhsf Capital Jardins;1,03 B;0,77;8,25;2,38;293,02 K;Fundo de Fundos;Fundo de Fundos
2026-05-26;DIVS11;Sparta Infra Inflação Longa Fi-Infra;1,03 B;1,0;14,4;11,7;995,46 K;Fundo de Desenvolvimento;Fundo de Infraestrutura (FI-Infra)
2026-05-26;KORE11;Kinea Oportunidades Real Estate;1,02 B;0,64;18,37;11,7;2,20 M;Fundo de Tijolo;Lajes Corporativas
2026-05-26;IFRI11;Itaú Fic Fi Invest Finan Infra Cdi Rf Cp;1,01 B;0,98;15,94;10,8;1,47 M;Outro;Fundo de Infraestrutura (FI-Infra)
2026-05-26;BTCI11;Fii Btg Pactual Fundo De Cri;1,01 B;0,91;12,49;10,46;2,90 M;Fundo de Papel;Títulos e Valores Mobiliários
2026-05-26;KNOX11;Knox Debt Fdo. Invest. Part. Infraestrutura;1,01 B;0,96;5,92;4,97;445,61 K;Outro;Fundo de Investimentos em Participações (FIP)
2026-05-26;VGIA11;Valora Cra Fdo Inv Nas Cad Prod Agro;1,01 B;1,02;16,91;15,91;2,51 M;Outro;Fiagros
2026-05-26;URPR11;Urca Prime Renda;1,01 B;0,29;18,12;16,0;877,36 K;Fundo de Papel;Outros
2026-05-26;RBRP11;Rbr Properties;983,20 M;0,63;9,43;8,33;1,30 M;Fundo de Tijolo;Outros
2026-05-26;SNAG11;Suno Agro;968,64 M;0,94;14,83;11,05;1,72 M;Outro;Fiagros
2026-05-26;BBIG11;Fii Bbig;940,30 M;0,71;14,01;10,68;928,30 K;Fundo de Tijolo;Shoppings / Varejo
2026-05-26;BPML11;Btg Pactual Shoppings;925,07 M;0,69;16,62;8,35;1,63 M;Fundo de Tijolo;Shoppings / Varejo
2026-05-26;SNEL11;Suno Energias Limpas;889,95 M;1,06;14,12;10,09;3,40 M;Outro;Outros
2026-05-26;VINO11;Vinci Offices;814,63 M;0,5;12,27;9,98;632,70 K;Fundo de Tijolo;Lajes Corporativas
2026-05-26;RZAK11;Riza Akin;780,50 M;0,94;16,1;14,98;1,75 M;Fundo de Papel;Títulos e Valores Mobiliários
2026-05-26;PQAG11;Parque Anhanguera;777,82 M;0,97;10,63;8,98;674,84 K;Fundo de Tijolo;Logístico / Indústria / Galpões
2026-05-26;HABT11;Habitat Ii;775,31 M;0,77;16,25;14,84;1,59 M;Fundo de Papel;Títulos e Valores Mobiliários
2026-05-26;XPCI11;Xp Credito Imobiliário;774,50 M;0,93;13,17;12,51;1,98 M;Fundo de Papel;Títulos e Valores Mobiliários
2026-05-26;HSRE11;Hsi Renda Imobiliária;772,36 M;0,98;13,18;8,27;24,93 M;Fundo Misto;Híbrido
2026-05-26;RECT11;Fii Rec Renda Imobiliária;766,65 M;0,4;13,89;11,2;493,07 K;Outro;Híbrido
2026-05-26;RVBI11;Vbi Reits Fof (Old);760,04 M;0,81;5,81;11,14;1,18 M;Fundo de Fundos;Títulos e Valores Mobiliários
2026-05-26;RCRB11;Rio Bravo Renda Corporativa;735,51 M;0,71;7,66;7,25;1,46 M;Fundo de Tijolo;Lajes Corporativas
2026-05-26;JSAF11;Js Ativos Financeiros;727,01 M;0,81;13,3;10,68;1,87 M;Fundo de Papel;Títulos e Valores Mobiliários
2026-05-26;CCME11;Canuma Capital Multiestratégia;720,17 M;0,82;11,73;8,3;485,36 K;Fundo Misto;Outros
2026-05-26;BTAL11;Btg Pactual Agro Logística;692,44 M;0,75;13,21;10,64;575,19 K;Fundo de Tijolo;Outros
2026-05-26;RBRL11;Rbr Log;678,68 M;0,81;10,75;9,73;1,10 M;Fundo de Tijolo;Logístico / Indústria / Galpões
2026-05-26;HPDP11;Hedge Shopping Parque Dom Pedro;673,39 M;0,92;8,71;6,78;6,40 M;Fundo de Tijolo;Shoppings / Varejo
2026-05-26;MFII11;Mérito Desenvolvimento Imobiliário;667,38 M;0,55;23,65;13,8;2,60 M;Fundo de Desenvolvimento;Híbrido
2026-05-26;RZAG11;Fdo Inv Cadeias Prod Agro Riza Agro;666,16 M;0,92;16,76;12,78;1,59 M;Outro;Fiagros
2026-05-26;CPUR11;Classe Única Do Capitânia Hbc Renda Urbana;664,05 M;1,06;10,33;9,33;1,41 M;Outro;Híbrido
2026-05-26;KFOF11;Kinea Fii;655,83 M;0,86;11,73;10,28;1,13 M;Fundo de Fundos;Títulos e Valores Mobiliários
2026-05-26;XPIN11;Invista Industrial;646,32 M;0,72;13,77;9,98;955,76 K;Fundo de Tijolo;Outros
2026-05-26;PQDP11;Parque Dom Pedro Shopping Center;639,45 M;0,97;9,22;9,07;1,99 M;Fundo de Tijolo;Shoppings / Varejo
2026-05-26;CPOF11;Capitânia Office Fii - Fdo De Inv Imob;624,50 M;0,84;4,63;7,3;898,72 K;Fundo Misto;Híbrido
2026-05-26;TRBL11;Fdo De Invest Imob Tellus Rio Bravo Renda Logistic;620,53 M;0,82;11,86;9,77;3,51 M;Fundo de Tijolo;Logístico / Indústria / Galpões
2026-05-26;FATN11;Athena I;613,39 M;0,88;11,3;10,39;2,39 M;Fundo de Tijolo;Lajes Corporativas
2026-05-26;VIGT11;Vinci Energia;599,33 M;0,73;4,75;8,4;522,75 K;Outro;Fundo de Investimentos em Participações (FIP)
2026-05-26;ITRI11;Itaú Total Return Fii;595,66 M;0,88;12,56;10,47;1,46 M;Fundo Misto;Títulos e Valores Mobiliários
2026-05-26;BODB11;Bocaina Infra;562,62 M;0,9;14,98;10,07;1,07 M;Outro;Fundo de Infraestrutura (FI-Infra)
2026-05-26;BCRI11;Banestes Recebíveis Imobiliários;532,20 M;0,72;16,22;13,62;467,85 K;Fundo de Papel;Títulos e Valores Mobiliários
2026-05-26;FPAB11;Projeto Água Branca;523,94 M;0,31;10,06;8,02;714,08 K;Fundo de Tijolo;Lajes Corporativas
2026-05-26;BINC11;Bradesco Fic Rf Infra Cdi Créd Priv;487,44 M;1,0;15,91;9,29;554,52 K;Outro;Fundo de Infraestrutura (FI-Infra)
2026-05-26;INLG11;Inter Logístico Fii;479,93 M;0,64;12,47;9,85;296,96 K;Fundo de Tijolo;Logístico / Indústria / Galpões
2026-05-26;TOPP11;Rbr Top Offices Fii;479,66 M;0,59;16,14;7,76;864,17 K;Fundo de Tijolo;Lajes Corporativas
2026-05-26;TEPP11;Tellus Properties;478,38 M;0,89;12,65;9,58;1,93 M;Fundo de Tijolo;Lajes Corporativas
2026-05-26;VCRA11;Vectis Datagro Cr Agr;471,24 M;0,62;17,32;14,46;562,93 K;Outro;Fiagros
2026-05-26;ADSH11;Ad Shopping Fundo De Investimento Imobiliário;466,58 M;1,05;1,13;1,13;19,30 M;Fundo Misto;Shoppings / Varejo
2026-05-26;SARE11;Santander Renda De Aluguéis;464,92 M;0,94;1,09;8,45;831,29 K;Fundo Misto;Híbrido
2026-05-26;CACR11;Cartesia Recebíveis Imobiliários;464,44 M;0,35;43,24;16,65;4,52 M;Fundo de Papel;Híbrido
2026-05-26;HREC11;Hedge Recebíveis;461,57 M;0,92;12,3;11,73;354,99 K;Fundo de Papel;Títulos e Valores Mobiliários
2026-05-26;CPLG11;Capitânia Logística Fii;458,03 M;1,06;12,7;6,24;210,23 K;Fundo Misto;Logístico / Indústria / Galpões
2026-05-26;AFHI11;Af Invest Cri;457,27 M;1,01;12,56;12,07;592,60 K;Fundo de Papel;Títulos e Valores Mobiliários
2026-05-26;JMBI11;Jivemaua Bossanova;446,18 M;0,87;16,41;9,31;964,16 K;Outro;Fundo de Infraestrutura (FI-Infra)
2026-05-26;VRTM11;Fator Verità Multiestratégia;445,13 M;0,76;15,08;9,39;318,17 K;Outro;Híbrido
2026-05-26;PATL11;Pátria Logística;444,97 M;0,72;11,07;10,65;904,87 K;Fundo de Tijolo;Logístico / Indústria / Galpões
2026-05-26;XPCA11;Xp Crédito Agrícola;443,87 M;0,82;16,67;14,82;752,38 K;Outro;Fiagros
2026-05-26;RZAT11;Riza Arctium Real Estate;440,79 M;0,92;13,4;14,17;1,18 M;Fundo de Tijolo;Híbrido
2026-05-26;FCFL11;Campus Faria Lima;434,53 M;0,99;8,9;8,45;159,42 K;Fundo de Tijolo;Educacional
2026-05-26;HTMX11;Fii Hotel Maxinvest;430,89 M;0,9;12,02;9,82;391,27 K;Fundo de Tijolo;Hotéis
2026-05-26;ENDD11;Endurance Debt;429,77 M;1,09;9,07;7,14;305,82 K;Outro;Fundo de Investimentos em Participações (FIP)
2026-05-26;CLIN11;Clave Índices De Preços;428,99 M;0,92;13,01;9,64;961,68 K;Fundo de Papel;Títulos e Valores Mobiliários
2026-05-26;PPEI11;Prisma Proton Energia;427,80 M;0,88;16,16;9,32;335,17 K;Outro;Fundo de Investimentos em Participações (FIP)
2026-05-26;FGAA11;Fg Agro Fdo De Invest;425,97 M;0,93;16,17;15,43;1,09 M;Outro;Fiagros
2026-05-26;RINV11;Real Investor;424,87 M;1,0;12,13;10,76;409,18 K;Outro;Títulos e Valores Mobiliários
2026-05-26;BDIV11;Btg Pactual Infraestrutura Dividendos;417,08 M;0,93;17,73;17,96;349,04 K;Outro;Fundo de Investimentos em Participações (FIP)
2026-05-26;AZIN11;Az Quest Infra-Yield Ii Fip-Ie;416,90 M;1,02;19,0;12,76;1,14 M;Outro;Fundo de Investimentos em Participações (FIP)
2026-05-26;SNCI11;Suno Recebíveis Imobiliários;406,67 M;0,9;13,71;11,2;585,22 K;Outro;Títulos e Valores Mobiliários
2026-05-26;FIIB11;Industrial Do Brasil;405,07 M;0,77;9,12;8,64;293,87 K;Fundo de Tijolo;Logístico / Indústria / Galpões
2026-05-26;KNDI11;Kinea Estrategia Infra;402,00 M;1,04;14,76;8,15;1,06 M;Outro;Fundo de Investimentos em Participações (FIP)
2026-05-26;TRXB11;Trx Real Estate Ii;401,25 M;1,87;15,14;12,08;5,98 M;Fundo de Desenvolvimento;Híbrido
2026-05-26;ICRI11;Itaú Crédito Imobiliário Ipca;394,85 M;0,94;12,39;12,62;777,70 K;Fundo de Papel;Títulos e Valores Mobiliários
2026-05-26;LASC11;Legatus Shoppings;387,98 M;0,83;10,81;8,66;184,88 K;Fundo de Tijolo;Shoppings / Varejo
2026-05-26;BCIA11;Bradesco Carteira Imobiliária Ativa;385,44 M;0,88;11,21;10,22;511,15 K;Fundo de Fundos;Títulos e Valores Mobiliários
2026-05-26;BTRA11;Btg Pactual Terras Agrícolas;381,68 M;0,55;12,05;8,39;205,33 K;Outro;Fiagros
2026-05-26;BBGO11;Bb Fundo De Invest De Crédito Fiagro;377,36 M;0,73;15,84;12,91;487,28 K;Outro;Fiagros
2026-05-26;CXCO11;Caixa Imóveis Corporativos;375,12 M;0,7;13,57;11,11;116,15 K;Fundo de Tijolo;Lajes Corporativas
2026-05-26;AJFI11;Aj Malls;372,18 M;0,76;7,29;6,72;232,77 K;Fundo de Tijolo;Shoppings / Varejo
2026-05-26;IBBP11;Invista Brazilian Business Park Fii;371,76 M;0,91;10,64;10,29;1,94 M;Fundo Misto;Logístico / Indústria / Galpões
2026-05-26;AIEC11;Autonomy Edifícios Corporativos;366,74 M;0,8;6,68;12,22;1,42 M;Fundo de Tijolo;Lajes Corporativas
2026-05-26;NEWL11;Newport Logística;366,08 M;0,84;10,71;11,13;138,53 K;Fundo de Tijolo;Híbrido
2026-05-26;BARI11;Barigui Rendimentos Imobiliários I;363,70 M;1,0;4,77;12,3;1,01 M;Fundo de Papel;Títulos e Valores Mobiliários
2026-05-26;AZPL11;Az Quest Panorama Logística Fii;360,89 M;0,89;13,12;10,21;348,89 K;Fundo Misto;Logístico / Indústria / Galpões
2026-05-26;PLAG11;Vbi Agro;359,12 M;0,96;9,94;10,78;328,52 K;Fundo Misto;Outros
2026-05-26;LIFE11;Life Capital;358,04 M;0,9;17,69;14,95;1,30 M;Outro;Outros
2026-05-26;KISU11;Klima Fic Fundo Imobiliário Suno 30;356,88 M;0,83;12,5;10,59;954,33 K;Fundo de Fundos;Títulos e Valores Mobiliários
2026-05-26;PORD11;Polo Recebíveis Imobiliários Ii;355,83 M;0,87;14,16;13,18;567,97 K;Fundo de Papel;Títulos e Valores Mobiliários
2026-05-26;MANA11;Manatí Capital Hedge Fund;353,43 M;0,98;14,33;12,34;1,73 M;Outro;Títulos e Valores Mobiliários
2026-05-26;SNFF11;Sunofofi - Fii;353,25 M;0,83;13,6;9,76;389,48 K;Fundo de Fundos;Títulos e Valores Mobiliários
2026-05-26;RPRI11;Rbr Premium Recebíveis Imobiliários;352,53 M;0,8;14,58;13,24;624,10 K;Fundo de Papel;Híbrido
2026-05-26;XPSF11;Xp Selection Fundo De Fundos;348,57 M;0,81;12,21;11,42;441,95 K;Fundo de Fundos;Títulos e Valores Mobiliários
2026-05-26;CYCR11;Cyrela Crédito;344,92 M;0,94;14,59;12,17;778,96 K;Fundo de Papel;Outros
2026-05-26;KCRE11;Kinea Creditas;341,38 M;0,98;12,49;11,79;454,14 K;Fundo de Papel;Títulos e Valores Mobiliários
2026-05-26;OUJP11;Ourinvest Jpp;326,88 M;0,87;15,16;13,67;445,83 K;Fundo de Papel;Híbrido
2026-05-26;VPPR11;V2 Prime Properties;316,10 M;0,49;;7,55;286,92 K;Fundo Misto;Outros
2026-05-26;TRXY11;Trx Hedge Fund;315,03 M;0,94;16,21;7,99;179,59 K;Outro;Híbrido
2026-05-26;HDOF11;Hedge Desenvolvimento Logístico;312,52 M;0,98;;;1,41 M;Fundo de Desenvolvimento;Lajes Corporativas
2026-05-26;EGAF11;Ecoagro I Fdo Inv Cadeias Prod Agroind;310,13 M;0,91;18,93;16,27;1,48 M;Outro;Fiagros
2026-05-26;WHGR11;Whg Real Estate;306,04 M;0,95;13,14;11,65;250,29 K;Fundo Misto;Híbrido
2026-05-26;VGRI11;Valora Renda Imob Fundo De Inves Imob;306,01 M;0,72;21,6;17,45;531,92 K;Fundo de Tijolo;Híbrido
2026-05-26;BBFO11;Bb Fundo De Fundos;305,58 M;0,91;13,57;11,44;391,60 K;Fundo de Fundos;Títulos e Valores Mobiliários
2026-05-26;VSLH11;Versalhes Recebíveis Imobiliários;305,37 M;0,16;20,3;12,8;121,68 K;Fundo de Papel;Outros
2026-05-26;NMKS11;Nm Ksm Log;302,79 M;1,06;;;1,27 M;Fundo de Papel;Logístico / Indústria / Galpões
2026-05-26;SAPI11;Santander Papéis Imobiliários;297,17 M;0,92;15,67;9,76;258,85 K;Fundo de Papel;Títulos e Valores Mobiliários
2026-05-26;XPID11;Xp Infra Debêntures;285,64 M;0,56;14,57;13,11;173,80 K;Outro;Fundo de Infraestrutura (FI-Infra)
2026-05-26;BPFF11;Brasil Plural Absoluto;279,19 M;0,86;6,53;10,79;305,22 K;Fundo de Fundos;Títulos e Valores Mobiliários
2026-05-26;BODI11;Bocaina Infra Cdi Fic Fi Infra Rf;278,28 M;1,0;2,2;2,2;320,72 K;Outro;Fundo de Infraestrutura (FI-Infra)
2026-05-26;GAME11;Guardian Multiestratégia I;273,63 M;0,93;12,9;10,81;249,76 K;Fundo de Papel;Outros
2026-05-26;HGPO11;Cshg Prime Offices;272,90 M;0,99;;14,66;337,35 K;Fundo de Tijolo;Lajes Corporativas
2026-05-26;RBFM11;Rio Bravo Multiestratégia Fii;245,59 M;0,81;4,06;4,06;405,25 K;Fundo Misto;Híbrido
2026-05-26;VSHO11;Votorantim Shopping;240,77 M;0,64;11,52;10,21;107,86 K;Fundo de Tijolo;Shoppings / Varejo
2026-05-26;CRAA11;Sparta Fiagro Fdo Inv Nas Cad Prod Agro;239,88 M;0,98;15,04;13,33;677,08 K;Outro;Fiagros
2026-05-26;GRUL11;Icatu Vanguarda Gru Logístico;237,99 M;0,88;12,34;9,26;249,36 K;Fundo de Tijolo;Logístico / Indústria / Galpões
2026-05-26;RBED11;Rio Bravo Renda Educacional;235,52 M;0,94;;10,26;268,63 K;Fundo de Tijolo;Educacional
2026-05-26;COPN11;Copérnico Fip Infra;232,52 M;0,46;;0,66;316,63 K;Outro;Fundo de Investimentos em Participações (FIP)
2026-05-26;CXAG11;Caixa Agências;231,32 M;0,69;11,96;11,29;197,02 K;Fundo de Tijolo;Agências Bancárias
2026-05-26;HSAF11;Hsi Ativos Financeiros;226,27 M;0,92;13,82;13,3;795,50 K;Fundo de Papel;Títulos e Valores Mobiliários
2026-05-26;NSLU11;Hospital Nossa Senhora De Lourdes;222,87 M;1,06;16,74;10,07;142,44 K;Fundo de Tijolo;Hospitalar
2026-05-26;RDIV11;Rbr Desenvolvimento Iv;222,25 M;1,0;;;386,79 K;Fundo de Papel;Híbrido
2026-05-26;BLMG11;Bluemacaw Logística;220,05 M;0,66;14,61;11,59;264,43 K;Fundo de Tijolo;Outros
2026-05-26;JSCR11;Js Recebíveis Imobiliários;210,67 M;0,89;13,52;10,04;540,26 K;Fundo de Papel;Títulos e Valores Mobiliários
2026-05-26;VXXV11;Vx Xvi;208,64 M;1,73;;5,49;27,84 M;Fundo de Desenvolvimento;Outros
2026-05-26;VCRR11;Vectis Renda Residencial;207,95 M;0,56;9,64;9,67;273,23 K;Fundo de Tijolo;Outros
2026-05-26;AAZQ11;Az Quest Fiagro;206,81 M;0,92;16,82;16,41;340,82 K;Outro;Fiagros
2026-05-26;RBRK11;Rbr Prime Offices;203,84 M;0,91;;;3,78 M;Fundo de Tijolo;Híbrido
2026-05-26;HGFF11;Patria Imobiliário Fof;203,82 M;0,84;7,89;10,06;551,19 K;Fundo de Fundos;Títulos e Valores Mobiliários
2026-05-26;BIDB11;Inter Fi-Infra;202,54 M;0,98;15,34;13,55;219,03 K;Outro;Fundo de Infraestrutura (FI-Infra)
2026-05-26;JGPX11;Jgp Crédito;202,49 M;0,67;18,14;14,43;603,96 K;Outro;Fiagros
2026-05-26;FIGS11;General Shopping Fundo De Investimento;199,59 M;0,71;11,46;9,0;151,45 K;Fundo de Tijolo;Shoppings / Varejo
2026-05-26;CPTR11;Capitania Agro Strategies;198,82 M;0,8;16,63;12,6;196,20 K;Outro;Fiagros
2026-05-26;VCRI11;Vinci Credit;196,05 M;0,78;15,03;12,92;381,59 K;Fundo de Papel;Títulos e Valores Mobiliários
2026-05-26;VINF11;Vinland Infraestrutura Fi Fif Debentures Infra;191,93 M;0,9;9,12;3,39;376,86 K;Outro;Fundo de Infraestrutura (FI-Infra)
2026-05-26;SPXS11;Spx Real Estate Multiestratégia;190,65 M;0,89;14,56;10,73;476,13 K;Outro;Híbrido
2026-05-26;KIVO11;Kilima Volkano Recebíveis Imobiliários;190,00 M;0,73;18,02;15,63;370,77 K;Fundo de Papel;Títulos e Valores Mobiliários
2026-05-26;VVCR11;V2 Recebíveis Imobiliários;189,31 M;0,92;12,72;11,59;106,39 K;Fundo de Papel;Títulos e Valores Mobiliários
2026-05-26;RBHG11;Rio Bravo Crédito Imobiliário High Grade;188,80 M;0,76;14,62;13,96;389,04 K;Fundo de Papel;Títulos e Valores Mobiliários
2026-05-26;CYLD11;Cyrela Desenvolvimento Logístico Fii;187,63 M;0,51;25,07;25,07;100,32 K;Fundo de Tijolo;Logístico / Indústria / Galpões
2026-05-26;AGRX11;Exes Araguaia;185,79 M;0,8;17,65;12,58;303,22 K;Outro;Fiagros
2026-05-26;FIIP11;Rb Capital Renda I;185,30 M;0,67;12,46;9,84;272,71 K;Fundo de Tijolo;Híbrido
2026-05-26;HBCR11;Hbc Renda Urbana;184,87 M;1,26;10,13;9,74;9,98 M;Fundo Misto;Lajes Corporativas
2026-05-26;ALZC11;Fii Alianzac;184,59 M;0,79;16,45;13,7;426,40 K;Fundo de Papel;Títulos e Valores Mobiliários
2026-05-26;FIIP11B;Rb Capital Renda I (Old);184,00 M;0,81;;9,98;598,24 K;Fundo de Tijolo;Híbrido
2026-05-26;KOPA11;Kinea Oportunidades Agro I;183,98 M;0,76;30,08;10,5;220,64 K;Outro;Fiagros
2026-05-26;PLCR11;Plural Recebíveis;175,91 M;0,94;4,48;11,98;612,26 K;Fundo de Papel;Títulos e Valores Mobiliários
2026-05-26;RBHY11;Rio Bravo Crédito Imobiliário High Yield;175,70 M;0,84;16,35;14,71;360,31 K;Fundo de Papel;Títulos e Valores Mobiliários
2026-05-26;ARRI11;Átrio Reit Recebíveis Imobiliários;174,72 M;0,59;20,84;14,62;352,23 K;Fundo de Papel;Títulos e Valores Mobiliários
2026-05-26;BBRC11;Bb Renda Corporativa;167,02 M;1,0;12,92;12,06;114,97 K;Fundo de Tijolo;Agências Bancárias
2026-05-26;RZLC11;Riza Lecci;159,60 M;1,02;11,06;4,99;1,30 M;Fundo de Papel;Outros
2026-05-26;GCRA11;Galápagos Recebíveis Do Agronegócio;154,40 M;0,61;15,1;14,93;217,73 K;Outro;Fiagros
2026-05-26;BSLT11;Permuta Financeira Lote5;152,66 M;0,65;;;120,10 K;Fundo de Tijolo;Híbrido
2026-05-26;FYTO11;Nch Brasil Recebíveis Imobiliários;152,26 M;0,86;14,35;14,05;146,63 K;Fundo de Papel;Títulos e Valores Mobiliários
2026-05-26;NCHB11;Nch Brasil Recebíveis Imobiliários (Old);148,98 M;0,82;;11,77;109,74 K;Fundo de Papel;Títulos e Valores Mobiliários
2026-05-26;BTML11;Barra Malls Fundo De Investimento Imobiliário;146,20 M;0,66;13,67;11,34;11,66 M;Fundo de Tijolo;Híbrido
2026-05-26;BICE11;Brio Crédito Estruturado;144,85 M;0,7;7,45;8,28;1,65 M;Fundo de Fundos;Títulos e Valores Mobiliários
2026-05-26;EXES11;Exes;143,69 M;0,93;16,44;10,62;127,14 K;Fundo de Papel;Títulos e Valores Mobiliários
2026-05-26;OUFF11;Ourinvest;142,52 M;0,78;;10,19;264,30 K;Fundo de Fundos;Títulos e Valores Mobiliários
2026-05-26;SPDE11;Whg Finvest Sp Realty;141,74 M;0,71;;;138,33 K;Fundo de Desenvolvimento;Residencial
